job_title,experience,salary,location,job_type,url,company_name,description,posted_date,company_logo,apply_link,country,data_source,ingestion_timestamp,external_job_id
Team Leader,,"£30,800/yearly",ST18 0GP,Not specified,https://www.cv-library.co.uk/job/223388885,Turning Point," Job Introduction <p>At Turning Point, we support people across England with mental health issues. We make a real difference to their lives as we introduce them to the personal, flexible and realistic support they need to improve the quality of their lives in their communities. Passionate about people, you'll enjoy the scope and support to enhance your own life and career too, as you gain the experience, training and education you need to progress in your career with us.</p><p>This is a new crisis service, and is staffed 24 hours a day, 365 days a year. It comprises of 6 beds for short-stay accommodation, a drop-in service, and a phone support service. </p><p>Join our team at Turning Point as a Recovery Worker and you will play a full part in the day to day duties of the service, promoting recovery focused care and support plans to people who are experiencing a crisis with their mental health.</p> Role Responsibility <p>The main purpose of the role is to support the Service Manager in implementing and maintaining a high quality service designed to assist individuals to address and de-escalate their mental health crisis in a safe, friendly, non-clinical setting. You will be responsible for leading and supporting the team in delivering a high quality person centred service in line with the service specification.</p><p>In a role where no two shifts are the same, you will take the lead in implementing and driving high performance standards throughout the team and the service, underpinned with a clear vision and strong values base. This will include playing a full part in the recruitment process, coaching and supervising of staff, monitoring performance and presenting service data for commissioners and stakeholders, representing the service at meetings with other managers and external agencies, ensuring that organisational policies are adhered to, maintaining all health and safety processes and systems, and showing due diligence around the management of budgets and finance. You will also need to cover any core rota duties as and when needed operationally. Further duties include the overseeing of recording of service user information for reporting purposes and in line with GDPR, liaising with other health professionals, contributing to the safeguarding of vulnerable people, and ensuring that the premises are maintained in line with essential health and safety standards.</p><p>The role will require you to be able to work remotely when needed, and to be prepared to do some evening and weekend duties including being on the on-call managers rota.</p> The Ideal Candidate <p>You will be able to demonstrate good knowledge, experience and values essential to working in the mental health sector, through a proven track record of employment in relevant roles. You will have excellent verbal and written communication skills, and be able to represent the service at a range of meetings. You will ideally have some experience of leadership, which could include the supervision and mentoring of staff and/or volunteers. Knowledge and experience of safeguarding of vulnerable people is essential, along with a good understanding of adherence to GDPR and complying with health and safety processes and systems. Management training is provided in order for the successful candidate to work effectively, and to learn and develop within the role and beyond. </p><p>You will be confident in working with information technology on a range of software applications.</p><p>You will be able to oversee the delivery of therapeutic-style interventions in a person centred, non-judgemental manner. You will also have the ability to deal effectively and calmly with challenging situations, and be able to multi-task and work to conflicting deadlines.</p> About us <p>As a leading health and social care provider with more than 300 locations across England, we take real pride in the services we offer.</p><p>We run all of our services on a not-for-profit basis; instead, we invest every penny back into our services and people. We never stop believing in change for the better, and we work constantly to improve the lives of the people we support.</p><p>What Benefits Will I Receive?</p><p>We know reward looks different to each person and so whether its ways to make your money go further, a culture supporting recognition and celebration, or opportunities to boost your career – we want to support you in every way we can with our total reward package.</p><p>You will get 31 days’ paid holiday a year, increasing with each year of service up to 33 days. Plus the option to buy additional holidays and spread the cost.</p><p>Join our team and discover the comprehensive benefits we offer by following the link below to explore all the exciting perks available to our employees.</p><p>Turning Point Benefits</p> <p>Turning Point</p> Attached documents <ul> <li> MH - Team Leader Updated October 2023 mb (2).pdf </li> </ul> Apply ",2025-04-29,https://www.cv-library.co.uk/logo/small/9be6faad226a4e3287f1ee90df4ef6d4,https://www.cv-library.co.uk/job/223388885/Team-Leader/,UK,cv_library,2025-04-29T02:48:49.358991,223388885
Tax Accountant,,Not specified,Yorkshire and the...,Not specified,https://www.cv-library.co.uk/job/223388482,Genuit Group plc,"<p>Are you a motivated and detailed oriented individual with a strong work ethic and a desire to learn and grow within a dynamic finance team? Do you thrive on working independently and taking ownership of your responsibilities? If so, Genuit Group has an exciting opportunity for you!</p><p>As a Tax Accountant, you will play a vital role in our Tax &amp; Treasury Department, contributing to our UK corporate tax compliance and broader treasury functions. This is a fantastic opportunity to develop your skills in a supportive environment, even if you don't have extensive prior tax experience. We are looking for someone with the right attitude, a proactive approach, and the ability to work autonomously to contribute to our team success.</p><p>Responsibilities:</p><ul> <li>Project managing the collection of necessary data from the business for the preparation of UK corporate task tax returns</li> <li>Collaborating effectively with the Head of Tax and Treasury, and proactively learning to undertake tax technical analysis of transactions to ensure accurate inclusion in the tax returns.</li> <li>Partnering with their businesses and external advisors to assist with RDEC and Patent Box filings</li> <li>Providing support in areas of treasury including cash forecasting, consolidation, and bank account management with a proactive approach to understanding of contributing to these function</li> <li>Proactively identifying and suggesting ways to automate process is an realise efficiency by demonstrating initiative and continuous improvement</li> <li>Support in other aspects of our corporate tax compliance and reporting obligations</li></ul><p>What we're looking for:</p><ul> <li>A master’s or bachelor’s degree in accounting, finance, or tax from an accredited college/university. Relevant professional qualifications (such as ACA and/or CTA or equivalents) are also welcome.</li> <li>Experience in a tax or tax-related role is advantageous, we also value candidates with a strong aptitude for learning and proactive approach in developing new skills</li> <li>Advanced Excel skills.</li> <li>Practical experience in integrating technology (e.g., Microsoft / AI) into processes and solutions is desirable</li> <li>A keen eye for detail and the perseverance to drive projects to completion</li> <li>Ability to work independently and manage tasks effectively.</li> <li>Enthusiasm for identifying and implementing improvements to ways of working</li> <li>Strong interpersonal and communication skills, with the ability to clearly convey information and expectations.</li></ul>",2025-04-29,https://www.cv-library.co.uk/logo/small/293d80f68b28412abec70c44adf19c7c,https://www.cv-library.co.uk/job/223388482/Tax-Accountant/,UK,cv_library,2025-04-29T02:48:47.904013,223388482
HR Advisor,,"£30,000 - £38,000/annum","CF72, Hensol, Vale of Glamorgan",Permanent,https://www.cv-library.co.uk/job/223401433,Renishaw plc,"<p>Salary £30,000 - £38,000 depending on experienceLocation Miskin, south Wales with regular travel to HQ based in Gloucestershire</p><p>Hybrid working 3 days / week onsite (flexibility required to travel to other sites and be flexible on days)</p><p>We are looking to recruit a proactive HR Advisor to join our busy Human Resources team. This role sits within the Employee Relations team and reports to a Senior HR Business Partner. </p><p>The successful person will be enthusiastic, self-motivated, organised, focused and flexible. While working within a busy environment, this opportunity will provide support and training to the applicant to grow, develop and expand their experience, knowledge and skillset. There will also be opportunities to support other business areas to those you are assigned, as part of the wider Employee Relations team.</p><p>This is an exciting time to join the team as it is currently undergoing modernisation and there is a huge appetite for change, and therefore an opportunity to add value. The development of leadership and management capability of managers within the business is one of the key objectives that the team is currently supporting.</p><p>Responsibilities</p><ul> <li> <p>A strong generalist with in-depth employment law knowledge, who is comfortable running and advising on their own caseload (with support where required from a HR Business Partner), ideally with previous experience of working in an engineering, manufacturing or industrial organisation but certainly private sector.</p> </li> <li> <p>Develop strong business relationships with stakeholders and support, coach, influence and challenge managers in managing their teams, in line with best practice. </p> </li> <li> <p>To effectively handle a variety of HR related queries across the business (at all levels) and provide commercial, pragmatic and specialist HR advice in conjunction with current legislation and HR policy, practices &amp; procedures.</p> </li> <li> <p>Management of a range of employee relations cases, e.g. wellbeing, absence management, contract queries, disciplinaries, grievances, capability, redundancy/restructuring, family friendly policies etc.</p> </li> <li> <p>Support development for managers on how to facilitate team reviews, setting objectives and measuring results, and how to have regular conversations.</p> </li> <li> <p>Support training sessions to upskill managers.</p> </li> <li> <p>Support the embedding of our company values: Innovation, integrity, involvement, Inspiration and assess the impact.</p> </li> <li> <p>Contribute to ad hoc projects when required and support the role out of company people initiatives.</p> </li> <li> <p>Support with precedent creation and maintenance of HR documents.</p> </li> <li> <p>Contribute to policy reviews and make recommendations for improvement (supporting employee engagement initiatives). </p> </li> <li> <p>Ability to create, interpret and monitor a variety of HR metrics which assist the business through Workday.</p> </li> <li> <p>Provide information and recommendations to the HR management team, when required, with a view to developing/implementing new services, policies and procedures.</p> </li></ul><p>Requirements</p><ul> <li> <p>Degree calibre and CIPD Qualified or working towards.</p> </li> <li> <p>True HR generalist with experience of providing operational HR support.</p> </li> <li> <p>Confident in providing commercial and pragmatic HR advice to client groups who enjoy logic, process and detail.</p> </li> <li> <p>Ability to build rapport and strong stakeholder relationships with all levels of employees across the business to become a trusted advisor.</p> </li> <li> <p>Hands-on with strong operational experience who takes a pragmatic and commercially balanced approach to their work with excellent customer facing skills.</p> </li> <li> <p>Keeps up to date with employment legislation and HR best practice.</p> </li> <li> <p>Strong communication and presentation skills with the ability to influence stakeholders. </p> </li> <li> <p>Positive, proactive and collaborative team player who is also comfortable working autonomously.</p> </li> <li> <p>Proficient IT skills including MS Word, MS Excel and MS PowerPoint.</p> </li> <li> <p>Experience working in a dynamic environment.</p> </li> <li> <p>Driving licence, as travel between UK sites will be required.</p> </li></ul><p>Join our team and be part of a company that values innovation, collaboration, and the growth of its employees. If you are a strategic HR professional with a passion for driving organisational success, we encourage you to apply.</p><p>Benefits </p><p>When you join Renishaw, we're committing to your future career. That's because we believe in developing our people's skills and promoting them internally. We also offer a benefits package that's highly desirable; including a 9% non-contributory pension, discretionary annual bonus, *subsidised onsite restaurants and *coffee shops, free parking, *car sharing scheme and *24 hour fitness centres. (*not available at our Castle Donington, Exeter &amp; York sites).</p><p>We also want to promote a healthy work-life balance as much as possible, so we have introduced a hybrid working policy which allows for a combination of home and office based working depending on the nature of your role. We also offer a variable working programme, 25 days holiday plus bank holidays, Life Assurance policy of 12 times annual salary, Cycle to Work scheme, enhanced maternity pay subject to qualifying criteria, Health Cash Plan, the option to join BUPA Renishaw Health Trust and an Employee Assistance Programme for employees and family.</p>",2025-04-28,https://www.cv-library.co.uk/logo/big/7abd723b3a944065b350d57726e55b7f,https://www.cv-library.co.uk/job/223401433/HR-Advisor/,UK,cv_library,2025-04-29T02:48:58.328342,223401433
Audiologist,,"£40,000/annum",Daventry,Not specified,https://www.cv-library.co.uk/job/223386549,Boots Hearingcare,"<p>**Join Our Team as an Audiologist- Part time 3 days per week</p><p>Are you a field dispenser eager to manage your own clinic with the backing of a dedicated team? Or are you an NHS professional ready to dive into the exciting world of retail audiology? This could be the perfect opportunity for you! Join us and take the next step in your career with a role that offers growth, support, and a dynamic work environment.</p><p> </p><p>About UsWe specialise in tailored solutions for hearing challenges, offering comprehensive assessments, expert fittings, and dedicated aftercare. With our commitment to personalised care and cutting-edge technology, we aim to improve quality of life through better hearing. As part of the Sonova family, Boots Hearingcare benefits from decades of excellence, leading the industry in developing, manufacturing, and distributing hearing aids and cochlear implants.</p><p>About the Role:</p><p>As a Hearing Aid Audiologist, you will support our Daventry store, Tuesdays, Wednesdays and Thursdays managing appointments, delivering exceptional customer-focused Hearingcare solutions, and representing Boots Hearingcare as a trusted professional. Your role will be to guide customers through their Hearingcare journey, offering expert advice and tailored solutions from our full product portfolio, ensuring they receive the best possible care and support.</p><p> </p><p>Benefits at Boots Hearingcare</p><ul> <li>Car Allowance: Enjoy a car allowance of £5064 pro rata in addition to your basic salary to support your commuting needs.</li> <li>Competitive Salary: Circa £40,000 pro rata DOE + Car Allowance and Monthly bonus</li> <li>Boots Discount Card: Receive exclusive discounts on a wide range of products at Boots stores.</li> <li>Free hearing aids if you need them as an employee!</li> <li>Free Flu Vaccine: Stay healthy with free flu vaccines available at Boots Pharmacies &amp; Discounted for family members</li> <li>Pension Scheme: Secure your future with our comprehensive pension scheme.</li> <li>Flexible Benefit Box: Access our flexible benefit box to tailor benefits to suit your individual needs.</li> <li>Life Assurance Cover: Gain peace of mind with life assurance cover.</li> <li>Long Service Awards: Be recognised for your dedication with long service awards.</li> <li>Generous Annual Leave: Start with 25 days of annual leave, increasing with length of service to a maximum of 30 days, plus bank holidays.</li> <li>Telus: Access Telus, a confidential support network offering help and advice on matters both in and outside of work.</li> </ul><p> </p><p> </p><p>Person Specification:</p><ul> <li>BSc in Audiology or equivalent qualification.</li> <li>Health Care Professions Council (HCPC) Registration.</li> <li>2+ years post qualification experience.</li> <li>Consistent clinical audit results.</li> <li>Completion of CPD requirements.</li> <li>Achievement of commercial targets.</li> <li>Deep understanding of audiological principles and good administrative skills.</li> </ul><p> </p><p>Boots Hearingcare is an equal opportunity employer.</p><p>At Boots Hearingcare, we unite, nurture talent, and foster collaboration among individuals from diverse backgrounds to cultivate the strongest team in the marketplace. We are committed to ensuring equal treatment and opportunities for all candidates, regardless of their ethnic or national origin, religion, sexual orientation, marital status, gender, genetic identity, age, disability, or any other legally protected status. Join us in creating an inclusive and supportive environment where everyone can thrive and contribute to our shared success.</p><p> </p><p>“We Care, We drive innovation, We strive for excellence, We build the best team”</p>",2025-04-29,https://www.cv-library.co.uk/logo/small/98e7a1e5c8cd41be9149ace7e0cd52e2,https://www.cv-library.co.uk/job/223386549/Audiologist/,UK,cv_library,2025-04-29T02:48:49.837444,223386549
Maths Teacher,,Not specified,London,Permanent,https://www.cv-library.co.uk/job/223401037,Education Matters Group,"An excellent opportunity for an ECT to embark on an exciting journey as a Maths Teacher where you'll have the opportunity to inspire and guide the next generation of problem-solvers. As a permanent member of our dynamic team, you'll be at the forefront of shaping young minds, fostering a love for mathematics, and empowering students to reach their full potential. <ul> <li>Ignite a Passion for Maths</li> <li>Nurture Budding Mathematicians</li> <li>Join a Supportive, Collaborative Environment</li> </ul> Preferred Requirements: <ul> <li>Proficiency in utilizing various teaching methodologies, including the use of technology, to enhance the learning experience</li> <li>Excellent communication and interpersonal skills to foster positive relationships with students, parents, and colleagues</li> <li>Commitment to ongoing professional development and a desire to stay up-to-date with the latest trends and best practices in Maths education</li> </ul> Preferred Qualifications: <ul> <li>Possession of a PGCE or equivalent teaching qualification</li> <li>Registered as an NQT or Early Career Teacher (ECT), with the potential to thrive in a supportive environment</li> <li>Passion for making a lasting impact on the lives of young learners</li> </ul>",2025-04-28,https://www.cv-library.co.uk/logo/big/2b8cc233096e4310949e3906dbedec25,https://www.cv-library.co.uk/job/223401037/Maths-Teacher/,UK,cv_library,2025-04-29T02:48:48.938862,223401037
Audit Senior Manager,,"£60,000/annum","Manchester, Greater Manchester",Permanent,https://www.cv-library.co.uk/job/223400985,Brook Street,"<p>Audit Senior Manager</p><p>Salary: £60,000+, depending on experience Location: Manchester, United Kingdom</p><p>Relevant UK Work Experience Essential - No Sponsorship Available</p><p>An exciting opportunity has arisen for an experienced Audit Senior Manager to join a highly regarded and growing accountancy firm. This firm is known for its collaborative culture, flexible working approach, and strong commitment to staff development.</p><p> </p><p>The Role:</p><p>You'll manage a portfolio of audit assignments from planning through to completion, maintaining excellent client relationships and leading a team of auditors. You'll also be responsible for managing budgets, ensuring compliance with auditing standards, and driving continuous improvements in processes and team performance.</p><p> </p><p>Key Responsibilities:</p><ul><li><p>Lead and oversee audit and accounts engagements, ensuring deadlines and budgets are met.</p></li><li><p>Act as the main client contact, managing queries and maintaining relationships.</p></li><li><p>Review the work of junior staff, providing guidance and development.</p></li><li><p>Manage billing, budgeting, and variance reporting.</p></li><li><p>Ensure full compliance with FRS, IFRS, and audit standards.</p></li><li><p>Collaborate with internal teams to deliver a seamless client service.</p></li></ul><p> </p><p>About You:</p><ul><li><p>Qualified Accountant (ACCA, ACA, or equivalent).</p></li><li><p>Significant audit and accounts practice experience.</p></li><li><p>Strong leadership, coaching, and team management skills.</p></li><li><p>Excellent client relationship management abilities.</p></li><li><p>Proactive problem-solver with strong organisational skills.</p></li><li><p>Familiarity with Caseware and CCH systems is an advantage.</p></li></ul><p> </p><p>Benefits Include:</p><ul><li><p>Flexible and hybrid working options</p></li><li><p>Excellent career development and progression opportunities</p></li><li><p>Competitive salary and pension plan</p></li><li><p>Life assurance and well-being support services</p></li></ul><p> </p><p>If you're an experienced Audit Manager ready for your next challenge with a progressive and supportive firm, we'd love to hear from you. Apply now for a confidential discussion.</p><p>Brook Street NMR is acting as an Employment Agency in relation to this vacancy.</p>",2025-04-28,https://www.cv-library.co.uk/logo/big/4d1d54efe5d642ea9d6ff65fb073cdb4,https://www.cv-library.co.uk/job/223400985/Audit-Senior-Manager/,UK,cv_library,2025-04-29T02:49:00.939905,223400985
