job_title,experience,salary,location,job_type,url,company_name,description,posted_date,company_logo,apply_link,country,data_source,ingestion_timestamp,external_job_id
B2 Licensed Aircraft Engineer,,"£65,000 - £75,000/annum","Carterton, Oxfordshire",Permanent,https://www.cv-library.co.uk/job/223400979,Aeropeople Limited,"<p>Job Title: B2 Licensed Technician (line)- Sponsored Reservist</p><p>Salary: £68,868 per annum plus shift allowance and additional payments</p><p>Location: Carterton, Oxfordshire</p><p></p><p>Aeropeople are currently recruiting for a B2 Licensed Technician- Sponsored Reservist on behalf of our client based in Carterton, Oxfordshire.</p><p>This is an opportunity to be part of a world leading aviation service provider, working for a company that is truly committed to the development of its employees. The business provides end to end maintenance, military and civil flying programmes, training and major aircraft upgrades.</p><p>The purpose of the B2 Licensed Technician is to perform Aircraft Maintenance tasks, in accordance with company quality and regulatory airworthiness standards and working in conjunction with the Shift Manager to ensure that the operational service meets all of the customer’s contractual requirements.</p><p>You will be a reservist employed by my client which is not the same as being employed by the RAF. As a Sponsored Reservist you will be deployed in support of my client’s specific aircraft. When not required for military tasks, you will return to your civilian role with the company.</p><p>To qualify for Sponsored Reservist status you must hold a UK passport, be medically and dentally fit, and maintain the required fitness level.</p><p>Please note that this role will involve working a mixture of day and night shifts and will require someone able to be deployed for up to 6 months of the year.</p><p></p><p>Main Responsibilities: </p><ul> <li>Undertake scheduled and un-scheduled Aircraft Maintenance in accordance with the required regulatory and company requirements.</li> <li>Be responsible to the Shift Manager or nominated deputy for the receipt/ dispatch and servicing of aircraft. To include pre-flight checks; daily checks; weekly checks; scheduled maintenance, component changes; rectification and repair; mandatory inspection; role changes and aircraft re-fuelling within the scope of the Company Authorisation and in accordance with company procedures in a safe an efficient manner. </li> <li>Certify all servicing and maintenance tasks in accordance with their scope of authorisation and under the authority of the company Quality Manager.</li> <li>Ensure that all technical staff working under his supervision perform their duties in a safe and correct manner and in accordance with the relevant documentation.</li> <li>Assume direct control of documentation for aircraft under his control and ensuring that all required certification entries are promptly and correctly recorded.</li> <li>Control of any material or company equipment provided for the task and the cleanliness of their working area.</li> <li>Be available at short notice to perform AOG recovery of aircraft from deployed operations.</li> <li>Liaise and discuss technical issues and forthcoming scheduled inputs with Planning.</li> <li>Co-ordinate the ground movement of aircraft assigned by the Shift Manager.</li> <li>Ensure H&amp;S requirements are met and adhered to under all circumstances.</li> <li>Report all safety / disciplinary matters to the immediate Line Manager.</li> <li>Conduct any other such duties that may be required from time to time, and as directed by the Line Manager.</li> <li>Be personally responsible for delivering a safe service in all facets of the role in line with the requirements of the SMS, Quality and Environmental Management Systems. This Includes maintaining awareness of the company safety and quality policies and the applicable hazard analyses.</li> <li>Deputise for senior engineer positions as required in periods of absence.</li> <li>Utilise the company GCIS Maintenance IT Support systems where applicable.</li> <li>Drive and/or operate all Company provided MTGSE in support of operational requirements in line with their authorisations.</li> <li>Capable of taking a safety focussed approach all facets of work.</li> <li>Knowledge of the relevant company Administration Processes.</li> <li>Document control management skills.</li> <li>Emergency Response actions and drills.</li> <li>Encouragement of the staff and open reporting in a just culture.</li> <li>Human factors – awareness and capability to deal with potential implications.</li> <li>Integrity and confidentiality in all aspects of the role.</li> <li>Investigation and analysis skills.</li> <li>Motivation and leadership capability for building the corporate safety culture.</li> <li>Resource management and planning.</li> <li>Understanding of company policies.</li> <li>Understanding of national Environmental Regulations.</li> <li>Understanding of the national workplace HSE regulations.</li></ul><p></p><p>Benefits:</p><p>- Basic annual salary of £68,868</p><p>- Annual shift allowance of £7,500 (paid monthly)</p><p>- Attestation payment of £3,313.44 when attested</p><p>- Sponsored Reservist bounty payments of £3,313.44 twice per year (subject to being deployable)</p><p>- Sponsored Reservist call out payment of £663.12 per quarter if deployed or completed any RAF training</p><p>- Military duty pay- £3.30 per hour</p><p>- Annual Dual Licence payment of £2,781 (paid monthly)</p><p>- Annual Bonus scheme</p><p>- Contributory Pension scheme</p><p>- 26 holiday days inc bank holidays (shift pattern)</p><p>- Private Medical Insurance</p><p>- Health Cash Plan</p><p>- Income Protection</p><p>- Life Assurance Cover</p><p>- Employee Assistance Programme</p><p>- Local gym discount</p><p>- Relocation packages available on an individual basis</p><p></p><p>About You:</p><p>- B2 UK CAA Licence.</p><p>- Must pass a CP2 Colour Vision Test.</p><p>- Must have at least 1 of the following type ratings: Airbus A330/ A320/ A321/ A380 or Boeing B747/ B777/ B787</p><p>- Experience working in both Line and Base maintenance environments.</p><p>- Desirable job holder qualifications &amp; experience at recruitment</p><p>- Demonstrable experience on commercial or military aircraft.</p><p>- Have previously held company approvals on commercial aircraft or military equivalent.</p><p>- Previous experience working within a MOD environment.</p><p>- Previous outstation experience.</p><p>- Hold a Full UK Driving Licence.</p><p></p><p>Please note that in order to apply for this role you will need to be eligible for SC (Secret Level) UK Security Clearance.</p><p></p><p>About Aeropeople:</p><p></p><p>Whether you’re looking for your next job or searching out the next superstar to join your team…</p><p>Aeropeople’s expertise and experience is entrenched in the aerospace, aviation, engineering, motorsport, automotive, and defence industries. We have the insight and know-how at both a local and international level to help bring people and businesses together, saving time and energy. Our capability is validated through our Engineering Services division encompassing Aircraft Line Maintenance services and Continuing Airworthiness Maintenance Organisation (CAMO), combined with our Aviation Training division offering technical training aircraft courses.</p><p>During registration, please let us know where you are currently located or which locations you would consider taking a position in, required salary and notice period.</p><p>For the latest news, events and jobs please search ‘Aeropeople Ltd’ on LinkedIn and Facebook for our latest jobs</p>",2025-04-28,https://www.cv-library.co.uk/logo/big/24de292b6c99427684a828ad2e4f87fe,https://www.cv-library.co.uk/job/223400979/B2-Licensed-Aircraft-Engineer/,UK,cv_library,2025-04-29T02:49:06.073122,223400979
PR Manager,,Not specified,Fleet,Not specified,https://www.cv-library.co.uk/job/223385050,CV-Library Ltd,"<p>At CV-Library, we have a simple vision: to help the world to work and we are looking for exceptional and talented people to help us realise this vision in both UK and overseas markets. </p><p>We are in a period of accelerated growth, following a year of key strategic acquisitions and significant investment across all parts of the business and we now have an exciting opportunity for a PR Manager to join the business. </p><p>Are you a media hound who can deliver media coverage, relish the sell-in, hijack the news, tell amazing stories, drive backlinks, and raise our brand profile? </p><p>Jobs fuel the economy, underpin national prosperity, provide fulfilment and purpose for people and power business success. </p><p>So if you want a PR role that provides plenty of news and is always relevant to the national conversation - this is the role for you.</p><p>The Role</p><p>We are looking for a creative and digitally minded PR Manager to elevate our brand's presence across both B2B and B2C audiences, shape public perception, drive high-value media coverage and support SEO. This role requires a sharp storyteller who can develop and pitch compelling narratives that position our brand as a thought leader in the industry. The role will need to communicate with both business audiences and consumer audiences, adapting storylines, tone and messaging accordingly. </p><p>You'll have experience creating campaigns that can deliver backlinks in support of SEO, by influencing the creating of owned assets (such as infographics, charts, calculators or other interactive elements) that can be used as part of PR outreach. This role is a sole-contributor that will suit a subject matter expert. </p><p>Responsibilities:</p><p>Public Relations and Thought Leadership</p><ul><li>Develop and implement a B2B and B2C PR strategy that secures high-impact coverage in relevant publications</li><li>Craft thought leadership campaigns that position key spokespeople and the business as industry authorities</li><li>Use data and insights to create compelling, newsworthy narratives that drive media interest </li><li>Create PR campaigns that deliver backlinks to support SEO</li><li>Identify and hijack key issues, trends and breaking news to insert the brand into relevant conversations</li><li>Develop suggested brand positions on industry topics, ensuring we have a clear, confident voice in the market</li><li>Build and maintain strong media relationships, securing opportunities for commentary, interviews and op-eds</li></ul><p>Internal Communications</p><ul><li>Develop an internal communications programme that engages and informs our people around the business strategy and performance</li><li>Create engaging and informative content for various communication channels, including internal newsletters, leadership cascade, emails, quarterly presentations and annual events</li><li>Write and edit content, ensuring accuracy, clarity and consistency </li></ul><p>Requirements</p><ul><li>Proven experience in PR and communications. </li></ul><ul><li>Strong ability to identify newsworthy opportunities and craft compelling stories. </li></ul><ul><li>Experience in delivering digital PR campaigns that support SEO and visibility in AI-search results. </li></ul><ul><li>A deep understanding of data-driven storytelling and how to use insights to create PR campaigns. </li></ul><ul><li>Experience in issues hijacking, with a knack for inserting brands into trending conversations. </li></ul><ul><li>Strong media contacts and experience pitching to journalists across consumer, business, and trade press. </li></ul><ul><li>Excellent writing skills, from press releases to social media copy and thought leadership articles. </li></ul><ul><li>Experience using tools such as Cision. </li></ul><p>Benefits</p><p> We are actively committed to promoting a fully diverse and inclusive workforce and we welcome applications for this role from all candidates who meet the key requirements. </p><p>Please do not hesitate to get in touch should you require any reasonable adjustments to assist with your application. </p>",2025-04-29,https://www.cv-library.co.uk/logo/small/a70a7816f00a47d8b160e7a5f07b131e,https://www.cv-library.co.uk/job/223385050/PR-Manager/,UK,cv_library,2025-04-29T02:48:44.797066,223385050
PR Manager,,Not specified,Fleet,Not specified,https://www.cv-library.co.uk/job/223385050,CV-Library Ltd,"<p>At CV-Library, we have a simple vision: to help the world to work and we are looking for exceptional and talented people to help us realise this vision in both UK and overseas markets. </p><p>We are in a period of accelerated growth, following a year of key strategic acquisitions and significant investment across all parts of the business and we now have an exciting opportunity for a PR Manager to join the business. </p><p>Are you a media hound who can deliver media coverage, relish the sell-in, hijack the news, tell amazing stories, drive backlinks, and raise our brand profile? </p><p>Jobs fuel the economy, underpin national prosperity, provide fulfilment and purpose for people and power business success. </p><p>So if you want a PR role that provides plenty of news and is always relevant to the national conversation - this is the role for you.</p><p>The Role</p><p>We are looking for a creative and digitally minded PR Manager to elevate our brand's presence across both B2B and B2C audiences, shape public perception, drive high-value media coverage and support SEO. This role requires a sharp storyteller who can develop and pitch compelling narratives that position our brand as a thought leader in the industry. The role will need to communicate with both business audiences and consumer audiences, adapting storylines, tone and messaging accordingly. </p><p>You'll have experience creating campaigns that can deliver backlinks in support of SEO, by influencing the creating of owned assets (such as infographics, charts, calculators or other interactive elements) that can be used as part of PR outreach. This role is a sole-contributor that will suit a subject matter expert. </p><p>Responsibilities:</p><p>Public Relations and Thought Leadership</p><ul><li>Develop and implement a B2B and B2C PR strategy that secures high-impact coverage in relevant publications</li><li>Craft thought leadership campaigns that position key spokespeople and the business as industry authorities</li><li>Use data and insights to create compelling, newsworthy narratives that drive media interest </li><li>Create PR campaigns that deliver backlinks to support SEO</li><li>Identify and hijack key issues, trends and breaking news to insert the brand into relevant conversations</li><li>Develop suggested brand positions on industry topics, ensuring we have a clear, confident voice in the market</li><li>Build and maintain strong media relationships, securing opportunities for commentary, interviews and op-eds</li></ul><p>Internal Communications</p><ul><li>Develop an internal communications programme that engages and informs our people around the business strategy and performance</li><li>Create engaging and informative content for various communication channels, including internal newsletters, leadership cascade, emails, quarterly presentations and annual events</li><li>Write and edit content, ensuring accuracy, clarity and consistency </li></ul><p>Requirements</p><ul><li>Proven experience in PR and communications. </li></ul><ul><li>Strong ability to identify newsworthy opportunities and craft compelling stories. </li></ul><ul><li>Experience in delivering digital PR campaigns that support SEO and visibility in AI-search results. </li></ul><ul><li>A deep understanding of data-driven storytelling and how to use insights to create PR campaigns. </li></ul><ul><li>Experience in issues hijacking, with a knack for inserting brands into trending conversations. </li></ul><ul><li>Strong media contacts and experience pitching to journalists across consumer, business, and trade press. </li></ul><ul><li>Excellent writing skills, from press releases to social media copy and thought leadership articles. </li></ul><ul><li>Experience using tools such as Cision. </li></ul><p>Benefits</p><p> We are actively committed to promoting a fully diverse and inclusive workforce and we welcome applications for this role from all candidates who meet the key requirements. </p><p>Please do not hesitate to get in touch should you require any reasonable adjustments to assist with your application. </p>",2025-04-29,https://www.cv-library.co.uk/logo/small/a70a7816f00a47d8b160e7a5f07b131e,https://www.cv-library.co.uk/job/223385050/PR-Manager/,UK,cv_library,2025-04-29T02:48:56.666875,223385050
Transformation Lead,,Not specified,WA16 6EZ,Permanent,https://www.cv-library.co.uk/job/223400685,Barclays Bank PLC,"<p>We are looking for a seasoned Transformation Lead that brings infrastructure technology experience as well as strong problem solving and analytical skills to solve major challenges and unlock opportunities that are key to achieving the long-term technology and commercial strategy of the Global Technology Infrastructure Services (GTIS) and the Chief Technology Officer (CTO) organizations. The role of GTIS is to build and operate a functional, scalable and highly available utility infrastructure capability, leveraging our enterprise scale to achieve at or below best-in-class hardware and software unit costs. The CTO oversees the architectural landscape of over 3,000 business applications with the core role to enable the delivery of a world-class technology landscape underpinned by strong controls and a commercial mindset.</p><p></p><p></p><p>To be successful as a Transformation Lead you should have experience with</p><p></p><ul><li>Commercial transactions in a technology infrastructure environment with the ability to analyze new and existing third party supplier agreements, apply the commercial strategy and principles, and deliver a well-coordinated solution to our clients.</li><li>Procurement, sourcing, supplier management, and service management in a technology infrastructure organization with complex regulatory requirements such as large Financial Services firms, both on premise and in the public cloud.</li><li>Analyzing and evaluating new and existing hardware, software and services contracts for infrastructure technology solutions and make recommendations on commercial terms that best match the firm’s requirements of performance, costs, speed of delivery and scale.</li></ul><p></p><p></p><p>Some other highly valued skills may include</p><p></p><ul><li>Exposure to modern virtualization and containerization technologies as well as migrating from legacy technologies.</li><li>Ability to be forward thinking in 3-4 year time horizons and to develop tactical and strategic plans.</li><li>Ability to lead and build virtual teams embracing the priorities of talent, diversity and inclusion.</li></ul><p></p><p></p><p>You may be assessed on the key critical skills relevant for success in role, such as risk and controls, change and transformation, business acumen strategic thinking and digital and technology, as well as job-specific technical skills</p><p></p><p></p><p>This role will be based in our Knutsford office.</p><p>.</p><p>Purpose of the role</p><p>To build and maintain infrastructure platforms and products that support applications and data systems, using hardware, software, networks, and cloud computing platforms as required with the aim of ensuring that the infrastructure is reliable, scalable, and secure. Ensure the reliability, availability, and scalability of the systems, platforms, and technology through the application of software engineering techniques, automation, and best practices in incident response. </p><p></p><p>Accountabilities</p><ul><li>Build Engineering: Development, delivery, and maintenance of high-quality infrastructure solutions to fulfil business requirements ensuring measurable reliability, performance, availability, and ease of use. Including the identification of the appropriate technologies and solutions to meet business, optimisation, and resourcing requirements.</li><li>Incident Management: Monitoring of IT infrastructure and system performance to measure, identify, address, and resolve any potential issues, vulnerabilities, or outages. Use of data to drive down mean time to resolution.</li><li>Automation: Development and implementation of automated tasks and processes to improve efficiency and reduce manual intervention, utilising software scripting/coding disciplines.</li><li>Security: Implementation of a secure configuration and measures to protect infrastructure against cyber-attacks, vulnerabilities, and other security threats, including protection of hardware, software, and data from unauthorised access.</li><li>Teamwork: Cross-functional collaboration with product managers, architects, and other engineers to define IT Infrastructure requirements, devise solutions, and ensure seamless integration and alignment with business objectives via a data driven approach.</li><li>Learning: Stay informed of industry technology trends and innovations, and actively contribute to the organization's technology communities to foster a culture of technical excellence and growth.</li></ul><p></p><p>Vice President Expectations</p><ul><li>To contribute or set strategy, drive requirements and make recommendations for change. Plan resources, budgets, and policies; manage and maintain policies/ processes; deliver continuous improvements and escalate breaches of policies/procedures..</li><li>If managing a team, they define jobs and responsibilities, planning for the department’s future needs and operations, counselling employees on performance and contributing to employee pay decisions/changes. They may also lead a number of specialists to influence the operations of a department, in alignment with strategic as well as tactical priorities, while balancing short and long term goals and ensuring that budgets and schedules meet corporate requirements..</li><li>If the position has leadership responsibilities, People Leaders are expected to demonstrate a clear set of leadership behaviours to create an environment for colleagues to thrive and deliver to a consistently excellent standard. The four LEAD behaviours are: L – Listen and be authentic, E – Energise and inspire, A – Align across the enterprise, D – Develop others..</li><li>OR for an individual contributor, they will be a subject matter expert within own discipline and will guide technical direction. They will lead collaborative, multi-year assignments and guide team members through structured assignments, identify the need for the inclusion of other areas of specialisation to complete assignments. They will train, guide and coach less experienced specialists and provide information affecting long term profits, organisational risks and strategic decisions..</li><li>Advise key stakeholders, including functional leadership teams and senior management on functional and cross functional areas of impact and alignment.</li><li>Manage and mitigate risks through assessment, in support of the control and governance agenda.</li><li>Demonstrate leadership and accountability for managing risk and strengthening controls in relation to the work your team does.</li><li>Demonstrate comprehensive understanding of the organisation functions to contribute to achieving the goals of the business.</li><li>Collaborate with other areas of work, for business aligned support areas to keep up to speed with business activity and the business strategies.</li><li>Create solutions based on sophisticated analytical thought comparing and selecting complex alternatives. In-depth analysis with interpretative thinking will be required to define problems and develop innovative solutions.</li><li>Adopt and include the outcomes of extensive research in problem solving processes.</li><li>Seek out, build and maintain trusting relationships and partnerships with internal and external stakeholders in order to accomplish key business objectives, using influencing and negotiating skills to achieve outcomes.</li></ul><p></p><p>All colleagues will be expected to demonstrate the Barclays Values of Respect, Integrity, Service, Excellence and Stewardship – our moral compass, helping us do what we believe is right. They will also be expected to demonstrate the Barclays Mindset – to Empower, Challenge and Drive – the operating manual for how we behave.</p>",2025-04-28,,https://www.cv-library.co.uk/job/223400685/Transformation-Lead/,UK,cv_library,2025-04-29T02:49:06.044122,223400685
